,shop_comment
1955,"防晒霜的功能有多强，除了防晒之外还能做些什么呢，想不到吧，其实防晒霜除了防晒之外还能补水保湿，还能遮瑕哦，同时还能带来清爽的触感，是不是很不错呢，这样的防晒霜难找寻吗，其实一点不难的，只要认准九美子冰...,提起九美子冰冰防晒霜，我总会想到它的包装，而今天要说的是这款银色包装的九美子冰冰防晒霜 30，它很清爽滋润，带给肌肤一种很细腻很年轻的感觉，令肌肤可以得到全天候的温柔呵护，变的异常的美丽动人，我喜欢这款防...,每一天都有快乐的心情，全天候都可以享受温和的防晒，用了这款九美子冰冰防晒霜 30，就可以享受到天然的呵护效果，全新的美丽配方，不可多得，使用的时候也有惬意的感受。 热情添加了自然的美肤成分，让防晒的功能有...,全天的温柔呵护，细腻的美丽营养，会让肌肤变得年轻起来。我的美丽呵护选择就是九美子冰冰防晒霜 30。因为在防晒的同时，还可以美化肌肤，这样双倍的美丽体现，让我欣喜珍惜，热情收藏。打开化妆包，就可以随时涂抹，...,蕴含有完美营养精华的防晒霜，才可以既保护了肌肤细胞，又美化了青春容颜。双重的呵护，缺一不可。九美子冰冰防晒霜 30，真的做到了这两方面的肌肤呵护，焕然一新的肌肤让我光彩照人。 这款九美子冰冰防晒霜 30，深深...,这些日子，总是不可避免的要到外面发传单，虽然不需要很久的时间，可是防晒成了最大的问题。发现小姐妹们都有九美子冰冰防晒霜 30，我也赶快买回来使用。用了才知道，柔和的品质，是我一直寻找的感觉。不让肌肤细胞有...,平平常常，清清爽爽的使用，就会收到可心的防晒效果。九美子冰冰防晒霜 30，带给我的不仅仅是普通的防晒，更是对肌肤的美丽呵护，使用了之后，肌肤就变得越来越好，细润光泽，营养丰富，超赞的选择。 这款九美子冰冰...,科技的完美功效配方，美丽的精华萃取凝聚，给我的肌肤，带来白皙水嫩的状态。使用了这款九美子冰冰防晒霜 30之后，有了太多的心得体会，抑制不住发到朋友圈里，朋友们也都非常喜欢，竞相选购。 像我这样特别爱外出购...,天然气息加入到防晒霜里面，就可以及时保护肌肤健康，还可以有效美丽肌肤营养，这样的防晒霜出奇的好。不仅给我悉心的呵护，还可以智慧的保障。九美子冰冰防晒霜 30，全新的美肤理念，带来美丽的欣欣活力。 拥有各种...,随时都可以带来完美的水润享受，还可以让肌肤细胞美美的，得到天然的呵护。这就是九美子冰冰防晒霜 30带给我的使用效果。天然的美丽成分就是不一样。深深的感悟效果，带来年轻逆龄出现，再也不会暴露自己的真实年龄。..."
1956,"很喜欢，夏天挺润的，也不油，保湿足够...,网红产品 跟曼秀雷敦的薄荷款的润唇膏外形很像 但是质地没有曼秀雷敦的滋润 保湿力不是太够 加上有薄荷成分 所以应该更适合夏天用吧？还有一点 虽然它的量很足 但是用时间久了 未免久有点腻了 总是性价比还可以 但是..., 薄荷凉凉的很喜欢，夏天用不错，做个唇膏打底也行~~   其余的季节也可以，大冬天不太行。   适合唇部没啥问题的~~    ...,一生推！比很多大牌子的润唇膏都好用，性价比超高。我嘴唇容易干，所以常年无时不刻都在涂润唇膏，今天初冬有段时间润唇膏涂得不是很勤，再加上家里暖气太足，导致嘴角两边开裂，都不敢张大嘴，涂了一段时间的凡士林...,在朋友那买的，人肉回来的，特别好用，我觉得近江兄弟也真的是平价的好唇膏了，小日本在彩妆这方面做的还是很好的。...,挺凉的  但是没什么卵用啊...,还行，胜在便宜。优点是哑光质地，不会显得嘴唇发亮很廉价。
使用感：滋润度还行，薄荷味一会就消失了，膏体较硬，擦掉后嘴唇恢复原样。。。要不停擦...,薄荷味很浓，效果很好，很滋润，睡前涂一点起床都是水水的...,这款近江兄弟的薄荷唇膏也算是它家招牌之一，去日本的时候发现也摆在比较显眼的地方。我是回国以后买的超市货，上海产的，不知道跟日本产有没有区别。膏体偏硬这点大家都说过了，涂上去有凉凉的感觉，滋润度中等吧，...,膏体较硬，适合春夏用，冬天肯定会不够 滋润。里面加了薄荷会对唇部有刺激吧， 不适合长期使用。刚擦上的时候凉凉的很 舒服，也不油腻，不猪油嘴，价格也可 爱。一支可以用好久…明年夏天还会回购..."
1957,"水蜜桃味很香,很好闻,而且用了蛮滋润的, 不过,我爱的是防晒功能,可以防治唇部色素沉淀呢~...,对水果味的唇膏都很爱，滋润度刚好，反正唇膏经常补的。不过我们这儿的屈臣氏现在没有这个唇膏卖了。...,很好 推荐给大家...,好好闻哟。 超想吃了它~ 防晒可以哟~ 我四季都OK哟~ 就是保湿不够！...,在薄荷的那款后面买的

这款比较干 而且回味想吐 让人很不舒服的水蜜桃味~~闲置了...,还不错...,涂上去有点光泽度,味道好闻,除此之外,一无是处,一点都不滋润,还有越涂越干的倾向,我快冬天的时候涂,2个小时不到就爆皮了....,又香又甜，甜蜜的味道，涂抹之后旁边的人都能闻到，很不错哦...,自从用了近江的润唇膏就再也不想换别的啦...实在是物美价廉好的没话说...滋润度很高又不油腻...保湿效果也不错...味道也很好...超级赞......,自己用过之后心服口服..."
1958,"好用。虽然只有30ml，但是好用。...,我朋友用了，无功无过。价格很便宜哦。
拿来擦身上还不错?...,很温和，我是敏感皮，用了都没过敏。但是防晒效果一般...,香港买40港币吧。本来我油皮觉得它使用感不舒服，油，但是在皮肤出问题的时候，用它也不会爆痘或者感到刺激，打一点散粉吸油就没什么问题了。缺点就是指数不高，但是这样也就减轻了负担了，适合室内日常。没有酒精。...,这个之前同学从网上买过试了一下，觉得还是比较耐晒的一款防晒霜哦，就是涂抹的时候要注意避开眼睛，这个防晒霜会有一些熏眼睛，不过皮肤涂上还是觉得很温和的，没有什么特殊的香味可是他是粉色的所以我还是会有机会...,好用不贵...,前前后后买了六瓶。这个防晒给我的印象还不错的说~首先是很便宜，第二就是很温和 ，虽然是化学防晒，但是可能真的像产品宣传那样，用了特殊工艺将紫外线吸收剂包裹起来，所以即使涂在眼部也会有刺痛流泪感。第三就是...,小瓶子的造型好Q好可爱呀,小小一瓶可以放在包包里,随时补补,质地很清爽,不会很油腻....,很好用~但是太小一只了，要是用作身体防晒的话，没几天就完了~~...,在sasa闲逛时所买的，一开始不知道功效那么牛，有一次跟朋友去沙滩玩了一整天，大家都擦防晒了，我也擦了这款小熊防晒，一天下来别人多多少少都晒黑了，居然我，是我，没怎么黑，让大家羡慕羡慕很久，我才发现小熊功..."
1959," 价格便宜，但量很小，而且比较费，很快就用完了。      乳液质地，像修正液似的，涂身上是又油又干的感觉，也就是不够保湿，但涂完身上有层东西，发着哑光……基本没有提亮肤色的作用。      说是防水，出汗多的夏天...,曼秀雷敦旗下推出的产品，红加蓝，双管其下，个人觉得，这两款其实没多大区别。
都是白色乳液质地，质地有点稀，使用之前先摇晃均匀再涂抹吧。很轻薄，触感柔滑舒适，流动性较强
蓝管的有薄荷成分吧，涂上去很清爽，...,三星吧，一个是因为假货太多，很容易买到假的。再就是正品的防晒效果也不是很明显，使用感倒不错。防晒这东西就是这样，一分价钱一分货吧。它家白金滋润和美白的倒是很好用，也贵不了多少，买那个更合适。...,白..., 看似很便宜但是量不大，抹身体用不了几次，这样算下来性价比不高 身体防晒还是得买大瓶的经用些 虽说是50倍防晒，但有人还是被晒黑 清爽的质地是很喜欢，但抹身上有点倒拔干...,这次使用的是近江兄弟绝对強力透明防晒乳液SPF50PA+++  此款防晒乳为强紫外线高效户外登山暴晒型，弱酸性，无着色，防汗配方，不含化学防晒剂，让肌肤呈现自然光泽，强力防晒，防止晒斑产生。 UV指数为SPF50 PA+++，...,晋江兄弟的防晒，我老妈特别爱用说，经济实惠，还好用，不油腻好吸收，一个夏天基本近江会用2瓶~毕竟瓶子比较小...,早上涂完中午脸绷得厉害，不过比蓝色的好点，没那个凉。防晒波段不太全，但是还是能防点晒黑的。...,防晒力还可以，去云南还是黑了但是没伤，是的它不会油，因为它很干很干很干！倒拔干累爱，债见。...,小熊的是最近火热的防晒，但是个人认为性价比不高，一小瓶身体的话，也就三次就没了~..."
1960,"现在国内超市也有这一款在卖了，真的很好用。性价比远远超过安耐晒、露得清、水宝宝、香蕉船等一众品牌，妥妥的随身必备法宝。...,同事送的圣诞小礼物，很可爱的一小瓶。摇一摇，会发现瓶里有涂改液瓶里那种小珠珠。质地很稀，涂上脸也很清爽，如果不看说明，绝对不会想到这居然是一款物理防晒。不是说物理防晒一般都比较厚重么？这质地简直比国内...,每年要买几瓶备着放在包里，防晒效果比小金瓶差，但50倍防晒夏天日常足够了，小小一瓶可以放在小包里面，随时补防晒。涂改液状防晒，涂上去微微有点儿油，过一会儿就好了。最主要的开车不会把座椅蹭的到处都是白色的...,好用...,便宜好用...,使用感比较糟糕，成膜很慢，油感和泛白明显……防晒能力较差，阴天出去玩，没打伞，不停补涂都晒黑了……唯一的优点是便宜？可是有什么用啊，摊手……..., 关键词：油润、化学防晒、spf50   总结：出游可选的高倍数化学身体防晒   细节：油！润！！使用感不太舒服，有点厚 ..., 抹得勤的话，还是不会黑的。毕竟清明去云南，也没被晒黑太多。。倒是最近通勤抹得不够，手表带印子又出来了T^T   有一丢丢抹不匀，总体还是可以的，比之前用的sunplay好多了。   但真的是要卸，我贪方便就用多一次洗...,去云南前突击买的，五天用掉1/3，涂改液状用起来还是挺废的，比碧柔浅蓝色细瓶那个好，回来没怎么黑。就是要涂好几次，而且要涂得多！完了还得用贝德玛擦一遍，不然洗不掉！...,很便宜的防晒。效果也很好。但是不适合平时用。只能军训或者旅游的时候用。因为防晒倍数太高，容易闷痘..."
1961,"自从怀孕之后就很少化妆了，
猛然一回头发现现在最流行的底妆产品已经是漫天飞的气垫BB了。

多谢来自闺蜜的慰问，九美子素真无瑕气垫BB霜。
我是天生的油性肌肤，平时化妆最大的问题就是出油，妆会花，不服帖。...,体验者：柏柏一直棒棒哒
年龄：24岁
肤质：混合型敏感肤质

感谢闺蜜网的厚爱，再次给我机会试用彩妆，心水九美子素真无瑕气垫BB霜好久了，终于有机会试用啦！

女生天生爱美，现在柏柏每天都会画个淡妆再出门...,近两年气垫BB霜算是一款大热的产品了，这个风潮从韩系彩妆蔓延到了欧美系大牌。因为具有隔离和粉底液于一身的功能，大大简化了化妆步骤，所以越来越受到大家的喜爱。今天试用的就是这样一款裸妆神器——九美子素真无...,很开心闺蜜网又给夹心一次高大上的试用~~
这次收到的是
九美子素真无瑕气垫BB霜
试用规格：试用规格：九美子素真无瑕气垫BB霜正装（198元/15g*2）
个人情况：本人23岁，坐标福建，教育行业，混合干性肌肤，皮肤偏...,好幸运可以收到这次的试用，感谢闺蜜网和小助手给我的机会，实在太开心啦！当时收到试用通过的消息才发现把地址写到老家啦，所以到现在才拿到，赶紧来写报告啦！一直很喜欢彩妆，能收到气垫真的很开心

 九美...,好幸运可以收到这次的试用，感谢闺蜜网和小助手给我的机会，实在太开心啦！当时收到试用通过的消息才发现把地址写到老家啦，所以到现在才拿到，赶紧来写报告啦！一直很喜欢彩妆，能收到气垫真的很开心

 九美...,



大家好，我是sara妞
（微博：Sara-小妞）

 自从韩剧星星的你播放以来
火到爆的不只是都教授
还有一款叫气垫BB的妆品脱颖而出

也是那时起
我们疯狂追捧气垫BB
一个小小的粉饼盒却包含大大的用处
...,
拥有一个美丽的素颜，不一定要每天化妆的哦。真裸妆真素颜同样可以吸引人的眼球的，轻薄透气，妆感细腻自然，就是裸妆最完美的一个境界了。“九美子素真无瑕气垫BB霜”一款可以打造出真裸妆真素颜的完美BB霜了。
...,希望能有好运...,大家好，我是小Z，新浪微博：zss801126
肌肤完美无暇，是每个人梦寐以求的，素颜时的小暇疵，常常会让我对自己缺乏自信，所以一款好的底妆产品非常有必要。
很开心可以在闺蜜申请到这款来自美白大师——九美子的素..."
1962,"我很喜欢...,好...,真的超好用！超赞，强烈推荐！...,凑合用着...,还行吧...,护肤必不可少的宝贝，让你全身都滋润得不得了。...,非常好用的乳液，吸收很快，很温和的一款产品，很喜欢。...,让肌肤越变越美...,有点保湿的效果，抹上之后显得皮肤很白净，感觉适合干性皮肤用，陌上不觉的皮肤干燥！很好用！...遮瑕效果不能说特别好但是毛孔有隐形，臭美一下我是天生丽质的...,很水润，适合这样干燥的季节来呵护皮肤。..."
1963,"护肤一整套都是克缇的，除了水之前用黛珂保湿精华。E油我是春夏晚上和秋冬早晚用，抹乳液时加两滴混合进去，抹完脸看着油但不闷。目前用半年多了敏感肌有改善不少...,美容买的，价格贵，当时说是抗氧化的作用抱着试试的心态就买了，多用几次觉得真心不好用，又油，皮肤也没有任何改善，不会再回购...,这个包装，我真的想说研究包装的人脑子没坏掉么？你去超市随便拿一瓶特级橄榄油，人家都知道要用避光的玻璃瓶，为什么就不想想人家为什么要用避光瓶呢？仔细看看成分吧- -人家的主要成分排名“橄榄果油”，不就是好一...,按摩效果不错啊，后就是有点油腻，适合干燥的肌肤使用啊，按摩后肌肤很水润嫩白啊，紧致肌肤。...,挺好的...,谷物中的小麦养育人类已有数万年的历史,而小麦中的生命精华-胚芽,富含丰富的优质蛋白质,维他命A、D、E、及B群，不饱和脂肪酸，核酸，叶酸等。胚芽伊油是从仅占小麦籽重量2%的胚芽中萃取出高单位的小麦胚芽油，结合锷...,用了有段时间了、唯一的感受就是油。还是价格很不可爱。。。。。。。。。我的银子啊。。...,感觉不大...,用起来还行...,大爱～滋养保湿的效果没的说。尤其适用于娇嫩的眼部..."
1964,"我相信口碑...,真好，不错...,这个我在美容院使用后感觉效果不错，特意与大家来分享 祖母绿的色泽外观，低调的奢华。  这款高机能的殿堂级水- 它蕴含金缕梅等天然植物萃取液，平衡PH值、软化角质、提高肌肤的含水量；防止皮肤变黑、淡化已生成的黑..., 25岁以后，随着年龄的增长，肌肤的新陈代谢功能降低让肌肤衰老表现越来越明显，干纹、细纹、色斑等开始形成。所以，补充肌肤所需，紧锁肌肤水分，是维持青春最有效的屏障。        这个是我在美容院使用后感觉效果不...,还不错...,真的很好，周围的人都力挺的宝贝哦！...,延展性很好，很滋润，保湿效果好。...,相当不错！有好感，会再买来用哦！...,补水保湿效果极佳，涂完以后即刻就能感觉到肌肤变得非常柔滑细腻，水润Q弹。有效滋养肌肤，增加肌肤弹性使肌肤盈润饱满。使用一段时间后，肌肤变得非常细嫩柔滑，水润富有弹性，紧致了一些。...,这款相比爽润乳液更适合于中、干性肌肤，也是一样的温和美白，保湿锁水。比较不一样的感觉就是用起来的乳液的质地更厚，所以形成锁水膜的感觉刚强烈些，但是却一点也不影响吸收。混合皮在秋冬天用肯定也会非常的棒的..."
1965,"去角质比以前用的温和很多，重点用了以后不干很润，以前的产品用了就干紧绷，这款不会，比较滋润，买了小支装的也能用挺久...,1分钟卸妆，3～5分钟深层清洁，15～20分钟去角质，3种用途，超方便，清洁到位，不能再爱！...,拖一个在克丽缇娜的朋友买的，刚开始的时候真的觉得好贵啊，但是用了一个星期，我知道觉得蛮有效果的，跟洁容霜一起购买的，清洁力度不错，也蛮温和的，毛孔也小了，我记得那个姐姐说，清洁不好买再好的护肤品也吸收...,最先买来卸妆,后来觉得不太卸的干净，乖乖作为去角质吧！但又是敏感肌，买了大半年没用上几次～...,克缇招牌，必推产品之一，乳化效果是不错，但是我还是喜欢水和油的卸妆产品，用不惯霜的，不会回购...,洗澡时用来敷鼻子深层清洁 没啥效果 当做普通洁面挺好 就是太贵了...,店里买了个50ml、很耐用，为的是下巴上闭口痘痘，集中用了一个月，效果不明显...,用着挺温和的，保湿效果很好！含植物性配方，天然温和，高亲肤性。 *卸妆及深层洁肤产品，可卸除彩妆并深入毛细孔，彻底清除污垢，天天使用温和不刺激。...,这个是我老公买给自己的，我俩刚谈恋爱那会儿，他怕我嫌他皮糙，哈哈就叫他妈妈带他去美容院做脸，随后买了一整套克丽缇娜的护肤品！老公的爸爸妈妈全是克丽缇娜的忠实粉，这款深层清洁结果他用了一次不喜欢味道就丢...,我很喜欢..."
1966,"好东西...,护肤必不可少的宝贝，让你全身都滋润得不得了。...,非常好用的乳液，吸收很快，很温和的一款产品，很喜欢。...,脸部摸起来滑滑的...,相当不错！有好感，会再买来用哦！...,没事就擦擦还是挺好。...,喜欢这个牌子的很多东东。...,这款乳液很温和，涂上去非常轻盈水润的感觉，有点凉凉的，好清爽，淡淡的香味清新自然，非常轻薄容易推开涂匀，感觉就像精华乳，轻轻按摩一会很快就吸收了，补水效果非常不错，用完肌肤摸起来软软的，滑滑的。...,很舒服的乳液...,使肌肤柔滑细腻、倍感水润。 激活肌肤细胞活性，清爽肌肤，呈现无瑕的丝滑质感。..."
1967,"很棒的产品...,这个不错的...,好...,用了感觉不错...,这个我在美容院使用后感觉效果不错，祖母绿的色泽外观，低调的奢华。 瓶身简洁优雅并且方便使用，按压口的设计  成分都很天然健康，香味是淡淡的清香，挺不错的~~  主要成分：维生素C衍生物、油溶性曲酸、夏威夷核果...,  这个香榭嫩白系列祖母绿的色泽外观，低调的奢华。         接下来使用同系列的克丽缇娜香榭嫩白水活保湿乳，与水一模一样的包装        主要成分：维生素C衍生物、油溶性曲酸、夏威夷核果油。        味...,说到面膜，大家肯定用过不少了吧。 现在的生活压力大，不少人常常为了工作或者其他的熬夜通宵。 这时候，最需要的就是一款可以补救的面膜。 睡眠面膜就是这时候需要的，在睡觉的时候敷上面膜，醒来后皮肤变得明亮水嫩...,向大家推荐一款平价又好用的克丽缇娜香榭嫩白水活保湿乳，性价比很高，效果绝对可以媲美大牌。...,第一次接触克丽缇娜香榭嫩白水活保湿乳，效果让我很满意，大家都知道护肤是一个循序渐进的过程，长期坚持才能看到效果。肌肤已经产生的问题不会擦了东西就立竿见影，只能慢慢改善，总体来说这款产品是非常值得试一试...,发发一些正在使用的乳液护肤产品，小白鼠各种试用，总结最好的经验给大家。..."
1968,"肤感挺好的，味道也好闻，干爽清凉。但是呢，还是晒黑了。...,修正液质地，就是还行的，夏天涂还不错。主要便宜..., 很便宜，一瓶二十几块，但容量很小，几天就用完了，我是用来涂身体的。      日系防晒都不是很油，这款不算特别出众，因为是小时候白雪修正液的质地，所以不会觉得很轻薄。上身之后还好。      防晒效果不清楚，因为..., 这款也是开架里的大热防晒了，原因主要是价格超级便宜，大概二三十？摇摇乐的质地，有点像涂改液，涂上很清爽，蓝色的会有点凉凉的薄荷感。成膜速度蛮快的，但是会熏眼睛，这点有点难受，防晒系数是50算不错了，我用..., 这款防晒大家应该都用过吧，拿来涂身体再适合不过了   防晒力够又超级便宜   摇摇乐质地，擦起来一点不心疼   蓝色、红色都用过，蓝色的有清凉效果   我更喜欢称它为冷感防晒   擦完干爽不油腻，不泛白   这款真的没...,这款防晒大家应该都用过吧，拿来涂身体再适合不过了 防晒力够又超级便宜 摇摇乐质地，擦起来一点不心疼 蓝色、红色都用过，蓝色的有清凉效果 擦完干爽不油腻，不泛白 这款真的没什么好说的，爬山、练车、学生们军训什...,冷感！夏季必备！ 价格便宜 涂改液质地 不泛白...,听防晒的，但是总觉得太便宜会不会不安全...,真的很凉爽，需要卸妆，轻薄，容易干，夏天总比较合适。...,价格便宜，清凉轻薄，夏天涂身体不错，价格也便宜。就是洗澡时涂过防晒霜的地方会很粘，一般沐浴露洗不干净，要用肥皂洗才行。..."
1969,"店里买了分装的25ml小奶瓶装，留着在家应急用，美容师帮着挑痘用着还行，实在不敢尝试市面上的，暂时还没找到可信赖的替代品...,长痘痘的时候买的。质地清爽，适合油皮痘痘肌肤。很好的收缩毛孔。紧致肌肤。抑制油脂分泌。...,就如题目上说的 这个客人痘痘一直好不了那是正常的！为什么？因为这个产品加的全是刺激物！去痘痘 杀菌 疏通毛孔的成分一点儿都没看见！可笑吗？生产这样的产品来有意思吗？薄荷醇 迷迭香都是刺激成分，看到有人说用...,长痘痘的时候买的，很好的滋润肌肤，美白效果很好啊，祛痘淡化痘印非常明显啊，很好的细致毛孔。...,用起来还行...,去年夏天因为用了 LANCOME 的美白产品后脸上狂冒闭合性粉刺， 因为在克缇办了卡， 这款是他们的主要祛痘产品， 买了瓶回家一直涂抹。 说实话涂了一段时间后皮肤会非常干但是痘痘还是坚挺的在那边不动摇。 不过后来痘...,刚开始时候用了四五天痤疮是变小了可是没过几天又长了，总是这样反复...,好东西,算是CHLITINA中比较好用的东西可,用了好多年,还会一直在用,也不贵,美容院买的话,凭美容卡,可以有7折的折扣,只要脸上有小红点出来,晚上涂一点精华液,早上起床就会消失了.我还推荐给我的几个同事,效果都不错~...,用来感觉涂手不错，用完脸上不油腻，吸收很快，很好推开的，很滋润，肌肤都滑的不行了，但是润而不腻，很不错的感觉，保湿程度也是不错的，肌肤基本上不会出现脱皮等缺水状态，整体不错...,刚涂完的时候，其实我觉得有点粘粘的，而且过了一阵之后脸上的皮肤就不会感觉粘了了，很清爽，很滑，很舒缓镇定..."
