,shop_comment
708,"感觉就是很细腻，而且非常爽滑，香味真的可以保持很久的...,抹上后很保湿，吸收快，滋润效果好。...,易吸收不油腻，不堵塞毛孔。不添加防腐剂，是个好东东...,一般般吧，味太浓了，这款好象真的象朋友说的一样挺温和的，用了三个月了，也没出现红点点...,使用后感觉皮肤比较滋润的，皮肤很有光泽，也感觉比以前有弹性了...,这个灰常滋润，不干，延展性也还好，擦在腿上腿会变白，遮瑕效果还是有的，但如果指望它强力遮盖的话还是算了哈哈。随着淡淡的幽香肌肤马上就吸收了， 而且补水保湿效果也很不错，肌肤吸收后没有任何油腻感，感觉很清...,可能对某些mm来说不耐闻。但滋润效果不错，总体来说性价比不错。...,不推荐...,很清爽，个人偏好吧 滋润效果不错，气味好闻，作为一个润肤乳很合格啦...,擦在身上很润 感觉比我之前用的所有的体乳都要好用 当然价钱也是千差万别 洗过澡之后擦身体睡了一觉香味..."
709,"水润奶油肌，光泽度一级棒，瑕疵遮盖了80％，就是夏天用太油了，冬天对于混合肌刚刚好。...,挺好的，满意。比那个阿玛尼，dior的好...,混油皮，妆前常规使用防晒霜，一般是安耐晒金管spf50，这只和防晒不是很搭，也可能是我皮肤原因，脱妆速度比较快。...,属于遮盖力很强的粉底，肌肤状态不好的时候用起来简直就是变了个人，马上白富美。缺点是妆感就有点厚，不如阿玛尼透明和自然，冬天会有点点干。...,官网入手的，我入的br20本身我是比普通人群看起来白一点的，但是用这个色号还是会显得更白，估计b20会比较适合大众。我是混合型皮肤，3小时左右妆容看上去特别美好。6小时鼻子会开始出油，8小时鼻子就油的特别厉害需...,这一只口碑很好，但是不适合我，我用这个脱妆超级快。...,很好用。...,这款算是好用的粉底液购买色号b10，很滋润，秋冬用液OK。对比下rmk这款没有介绍里说的那神奇，购买的202色号，没有很惊喜，图片大家自己感受，最后一张是涂抹20分钟后的效果，ysl比较润白。...,这款全是好用的粉底液购买色号b10，很滋润，秋冬用液OK。对比下rmk这款没有介绍里说的那神奇，购买的202色号，没有很惊喜，图片大家自己感受，最后一张是涂抹20分钟后的效果，ysl比较润白。...,感觉现在闺蜜网的测评越来越华而不实了，绝大部分都是好评，所以呢，刚拿到这个粉底液的时候还是蛮期待的，结果却挺失望的。我是混油白皮，而且有向油皮发展的趋势，所以我对肤感要求比较高。这款粉底液很厚重，擦上..."
711,"贞采源的柔肤水是跟那个祛痘修复的一起买的，真的很不好用，补水效果还好，不过混油皮我还是乖乖选个爽肤水吧，用着感觉有点油腻了。...,我是干性肌肤，网上很多大人都说用柔肤水比较合适，之前傻傻的用爽肤水。 旗舰店的客服推荐的这款柔肤水，用了感觉还不错哦，润润的，想如果是油性肌肤用的话可能真的会油哦···...,真好，不错...,挺好的...,赞一个...,还行吧...,朋友送的...,【谁说“闺蜜”不“女人”？】818自己的护肤品吧        还不错，滋润型的水，夏季用了水都不用乳液了。大一时候用的。   没有什么香味，简单补水保湿，皮肤稳定。那个时候真是什么都敢用啊。 ...,最近正在使用贞采源保湿活颜柔肤水，特喜欢贞采源家族护肤品，每一款都很有针对性，特别给力。非常适合25岁左右及40岁以下的女性使用。...,爱这款..."
712,"客服美眉说她美眉之前就是用了这款眼霜，脂肪粒都慢慢好了，我也就试试 用第二支了，黑眼圈和眼袋都不这么明显了，重要的是脂肪粒真的有变小了，不能说全是这款眼霜的功劳，因为我也按时睡觉，做按摩，但至少做的写算...,满满的一支眼霜，能用好久咧！性价比极高！ 朋友推荐购买的，没让我失望，用上感觉凉凉的，一点都不粘腻，按摩一下眼周，很舒服，一下子就能吸收了，坚持用一个星期，黑眼圈淡了一点哦，坚持用下去希望把我的眼袋也带...,清爽，也很容易吸收，坚持使用一周，黑眼圈有改善 主要是不粘腻，不辣眼睛，一点压力么有...,可能是我肌肤太干了，按摩一下下就吸收进去，眼周润润的，很舒服。 一只快用完，黑眼圈好了很多，眼袋也消了点。客服说脂肪粒也能消，不过我没有脂肪粒。 推荐给姐妹们 哦！...,睡眠质量不好，导致眼袋和黑眼圈都挺明显的。用了一个星期左右吧，每天早晚都用，改善很多，至少看起来不那么明显了，主要是没什么异物感，图上直接睡觉没啥感觉。继续用吧，希望能完全消除了眼袋和黑眼圈...,不知道什么时候开始有这么明显的黑眼圈了，大概是一不小心就过了12点才睡觉的后果吧。在天猫上逛逛看上了这款眼霜，抱着试一试的态度入手的。结果没让我失望，坚持半个多月天天晚上睡前半个小时用，黑眼圈淡了很多哦...,作为一个电脑工作者，熬夜是经常的事。这黑眼圈和眼袋真是无法直视了，每天得带上眼睛掩护。在网店瞎逛，看中这款眼霜，评价还不错就入手试试。 没让我失望！每天早晚用上一点，两个星期了，明显看到黑眼圈和细纹都淡...,灰常好...,缔造紧致光滑的细致眼周肌肤。...,看广告心里长草买的，还不错。..."
713,"开口大小正好很容易挤压，出来是透明的膏状，有一种特别的气味。涂在手背上比较黏黏的，搓几下就会有角质下来了。之后一定要用清水洗干净，有些角质粘附在汗毛上要留意的哟~洗出来手背就光滑多了，又白又嫩哈哈！...,补水效果很好，延展性也不错，温和水润的配方，很好的呵护肌肤，嫩白肌肤锁水效果很好，提升肌肤紧致度。...,这个啫喱的质地还不错，可还是有香精味。价格也不贵 能够把脸洗得很干净 但是美白效果当然没好到哪里去，是用了他们家的爽肤水才买这的，还成。...,洁面后，擦干脸上的水分，干爽才行，不能有水分。把啫喱点在鼻头、两颊、下巴、额头，均匀抹开，轻拍，就变水了，慢慢搓，就可以搓出角质来了。一两分钟就可以用清水洗掉了。 用过很多款去角质了，觉得这款比较好清洗...,买面膜赠送的中样，挤出来是啫哩状的，抹在脸上轻拍一下就变水了，慢慢搓，均匀搓，很容易洗掉，洗前和洗后的触摸感有明显对比，洗后嫩了一点，肤色好像也亮了点（可能心理作用哈）不管怎么样，我很满意这款去角质...,挤出一点在手背上，冰凉冰凉的，轻轻涂开后就变水了，加大点力打圈圈，慢慢角质就出来了。很容易洗干净。过了10分钟感觉润润。比之前用过某些大牌好多了。楼上说搓出来的是胶，其实你可以对比一下使用就知道了，第一...,这个不错的...,就用这个一直都是...,赞一个...,喜欢这个品牌..."
714,"请问：贞采源是正品吗？有没售后电话，可货到付款，验收后再付吗？...,上个月去海南了一趟，就网购了这款防晒乳液。 看到前面有些姐妹说不好推开，在抹防晒霜之前要抹一点润肤乳比较好，本身防晒霜不是很润的。这款防晒是还是很有用的，2月份海南的天气大家是知道的。我两三个小时补一次...,屈臣氏的导购说买一送一很划算，就入了两瓶，之后去屈臣氏，发现这玩意儿永远都在买一送一！根本就只值这么多嘛~闻起来是挺清爽的，可实际的膏体偏厚，而且偏白，不好推开。我是油皮，这种质地的膏体不敢往脸上用，拿...,建议大家以后去屈臣氏不要听那些售货员的""蜜语"".反正我是被忽悠了，而且没用过的，连拆也没有拆还不准退货！！还是自己上网找准品牌再买吧...,质地清爽个毛线，油死了，我脸的皮肤算是干性的了。但是抹完油光满面，油都快滴下来一样，...,被屈臣氏的售货员骗咯，还说搞活动79两支，见她那么仁慈，，就信了。原来两支都是用过的，有一支还只用剩一半左右，回到家一看，瓶子都是瘪的，给二手货我！！！...,春夏来临，阳光明媚，最适合到大自然的怀抱里尽情舒展，赏花、登山游玩、探险的美好时光一定不容错过。想要去马尔代夫度过悠长假期；想要去江南古镇体验小桥流水人家；想要短途踏青欣赏春花烂漫…… 然而，春夏游有险...,我皮肤容易长斑呀，想买个防晒霜，因为是油性皮肤，所以想买个清爽型的，本来打算买新碧的，结果被屈臣氏大妈忽悠的，还说是搞活动，79两只，结果涂在脸上白白的，有点油，然后就不爽了，并且不止我一个人这么认为呀...,本人敏感皮，新碧用着都过敏，这个没事。确实很油，不过搭配控油的粉底反而刚刚好，不爆皮。没被晒黑也是真的。一分钱一分货，也不用有太高的期待。涂上去比较白，反正就当修容了~还算喜欢~...,屈臣氏售货员介绍的，本来不想买的，看着比较优惠又方便，说可以保持8小时防晒的，物理防晒。那些2 3小时就要补一次。回来后用了根本不防水防汗，天太热一出多点汗脸上就白块黑块的。刚擦的时候好白又不怎么好擦特别..."
715,"膏体粉嫩嫩的挺好看，不过涂在脸上黏黏的，手上也黏黏的，效果也就是一点补水吧。……...,亿元秒杀，必须得瑟一下 洗完后，脸还是香香的红酒味，效果还不错哦~ 之前我就有用红酒来敷过面膜，脸润润的嫩嫩的，希望这个面膜继续用下去能给我惊喜...,很好 推荐给大家...,灰常好...,挺好的...,效果很好...,非常好...,向大家推荐一款平价又好用的贞采源红酒美白保湿面膜，性价比很高，效果绝对可以媲美大牌。...,季节更替需更换衣物，而我们的肌肤也应该适时换季养护啦！换季很烦恼，各种皮肤问题也随之而来，贞采源红酒美白保湿面膜天然、温和、无刺激，敏感肌肤的救星，换季必备单品。滋养修复各类型的肌肤，容易吸收且不油腻...,用了之后感觉就很好，而且毛孔真的有变小的．用完后有滑滑的感觉..."
718,"很滋润，吃了饭也不会全掉光，颜色很好看...,这个唇膏挺润的！喜欢！哈哈！...,闺密送的生日礼物，颜色很正，薄涂厚涂都很好看，不易掉色，也不拔干...,经典口红，颜色都很漂亮，特别是13号，气场2米8...,之前买过52号色。呵呵呵呵呵呵…但是83号色入手之后，我就觉得我错怪了这个品牌，建议大家去专柜试色，选择更滋润的，方管也分质地的。显白10000倍，秋冬必备，不拔干，很滋润，真的好看，没有理由不爱他。吹爆这只8...,最喜欢17号，非常温柔~~~想你色就算了，看颜值，自己涂上去就很难看..., 不能算作是首选唇膏，上唇非常显色，也很轻薄，但涂抹的时候不够顺畅，需要配合唇刷。   偏干的嘴唇需要打底。哑光色显得很高档。 ...,免税店入手，讲真这玩意儿涂上好像蜡笔一样难受，为啥这么火呢？好吧颜色确实好看，但掩盖不了涂上难受的事实。。...,感觉有些油。抚平唇纹是真的。...,1号色 正红 比想象中的水润很多，气场100
13号色 橘调红 有气色 人称棒子色哈哈哈哈
都喜欢！乐天免税店卖198 还是代购炒的太厉害了……..."
719,"华丽丽的过敏了，可能自己本身不适合用脱毛膏，用哪种都会过敏...,使用起来挺方便的，但是毛的根部很顽固的就是怎么都脱不干净，但是也不影响...,年前搞活动特价屯的货，现在开始用上啦~！ 先用热毛巾敷在要脱毛的地方一两分钟，抹上脱毛膏，稍微厚一点，大概是看不见皮肤的厚度。过5分钟后，用毛巾擦掉。然后用沐浴露+清水洗干净脱毛的位置。就算脱毛完成了...,用过很多脱毛膏了，这个也蛮不错的，味道还能接受，价格也合适，一支脱毛膏用在两边腋下的话，大概能用两到三次吧，重点是脱得干净才是王道啊····...,我们姐妹团因为经常要出活动，冬天也可能要穿抹胸的，所以脱毛膏是必备的，这个是搞特价的时候买的，除了有点味道意外，其他都还好，脱得蛮干净的，用在手、脚、腋下都可以，我们一般是洗完热水澡出来就抹上，一会就...,为了凑单购买的，这个时候用会不会觉得奇怪呢？呵呵··· 白色膏体，有点点味道，凉凉的，抹上等5分多钟用纸巾擦掉，去得挺干净的。没啥刺激。 第一次使用脱毛膏，庆幸能碰上好的。夏天也用这个了...,还行吧...,好...,感觉不大...,赞一个..."
720,"祖 玛珑 橙花香水,一喷上去就闻到了一股很清香的香味，象新鲜的橘子叶在手上撵碎后散发出的一股香味，非常清新，香味也很特别的哈，不喜欢大众香水味的选这款绝对错不了。...,申请很复杂，但是充满期待...,这款雅诗兰黛旗下的最畅销的香水，简朴的包装真心非常喜欢，香味维持度很足，希望有机会可以试一下这款新出的香水...,超级喜欢这款Jo Malone London 的香水，中性的，非常适合每天不同心情的我。希望有机会可以申请成功...,超级喜欢Jo Malone London 的香水，淡淡的不是很浓郁，适合任何场合...,想找到适合自己，产品效果好的护肤品...,Jo Malone London 祖•玛珑全新黑莓与月桂叶香氛体验...,首先感谢卖家能给予这机会，试用中心还真的不错,运气好的话可以免费试用到心仪的产品.一旦效果佳，我已经有一件宝贝试用成功了，我会继续支持卖家，大力度的宣传，支持到底！看着可以申请免费试用的产品让我颇然心动...,黑莓和月桂叶 感觉应该不错 期待试用...,美妆体验机会，大家速速来申请哦！..."
721,"最近对这款香水很长草，比较偏好柑橘和清甜的果味，想试下味道...,香味太甜了...,味道特别好闻～ 适合小女生～ 甜甜的桃花香～  留香也持久～...,写了一篇 一提交就剩第一句了 其他全没了！！ 这是怎么回事啊 第三遍了 永远都显示不完整！！


	


	 很高兴中了这次试用 Jo Malone London  申请的时候没有看到要去柜台领  
	收到短信的时候还惊讶了一下   短信提...,很开心收到Jo Malone London 祖玛珑的香氛体验，太感谢onlylady啦。 Jo Malone London 祖玛珑的香氛糅合艺术理念让您创造独一无二的香型以彰显自我个性。各款香氛既可单独享用亦可混搭使用，放飞您的想象力，让您自由...,猫猫是个瓶子控，实在受不了香水瓶的诱惑，看着桌面上越来越多的瓶子，总要收收性子不要在乱败。 在试用中心逛了逛，又被祖·玛珑香水的瓶子所吸引，手一贱又申请了一次试用小香来尝尝鲜。 没等到收到试用，我已经踏...,这次Jo Malone London 的包装很是精美，淡黄色的手提袋陪着黑色的蝴蝶结。优雅迷人。  1996年上市的红玫瑰是Jo Malone London的经典款香氛之一。妖娆、浪漫、纯净的红玫瑰堪称现代浪漫的极致经典，由7种世界最珍贵的...,夏天到了，动不动就出汗，有了香水，出汗也会香香的，希望可以申请到...,I LOVE JO MALONE...,现在很火的香水，淡淡的味道应该很适合夏天。..."
723,"朋友在生日的时候送了这款祖马龙的香水，很喜欢的香味，留香很久...,很喜欢，买的其他款，在做手部护理的时候用的这款沐浴露，很赞。柜姐给了我张卡片，回来问中后调很赞。下次可以去买这款~...,很喜欢的一款  当时种类太多闻得头都晕了  感觉这个还比较特别  回家后真的越喷越喜欢  温柔味道  我觉得留香时间很不错...,大概是祖玛龙里最喜欢的一款了，留香比他们家别的好一些，味道也厚重成熟...,很甜美的脂粉味，但不会浓腻，相比她家其他款的清新风格，这款显得略微艳丽，女性气息较浓。还是很喜欢这个味道的，闺蜜觉得很成熟，但我觉得是恰到好处的小女人香...,比红玫瑰那款丰富出好几个层次来，透出一股子女人，雍容的味道。非常适合冬天用，跟柏林少女有相通之处。...,很甜的味道...,之前看了几篇博客对这款香氛的介绍，买回来觉得味道还好吧，苹果味道好闻，实在不喜欢茉莉的味道。..., 最初是他甜甜的水果为吸引了我，深究起来才注意到却是又带了些有股脂粉味，相比他家其他香水，气味稍微丰富些。因为个人不是很喜欢脂粉味，觉得略显庸俗所以要count 它down了。   和其他脂粉类香水比较不是世故的贵...,甜甜的有股脂粉味，相比他家其他香水，气味稍微丰富些。..."
724,"超级喜欢这个味道，一开始觉得黑莓好闻，不过这个后味越来越好闻！他家的香水很多都可以两个味道混合用，不过我没有试过，还是喜欢单独的味道！...,一次郊游中，你的别出心裁的味道恰好落在他的鼻尖，抬起头，四目相对，夏日的阳光和微风里，满是热情甜蜜。...,算清新很像纯露的味道，比较纯粹但是谈不上爱，就是一般了。...,非常喜欢，淡淡的田园风格，宛若置身世外桃源，心情也变的轻松愉快。还会继续收其他的。...,好闻到没朋友 甜甜的橙花...,有茉莉的味道很喜欢...,大热的橙花亦是我的最爱。有人说它香一颗被剥开汁液迸发的橘子，我不太同意。橙花和橘子完全是两种不同的味道。和欧舒丹家的橙花不同，Jo家的称橙花没有一丝甜味，相反却有些植物茎叶的苦味，正是因为这个原因，当这...,这一款是JM里我最不喜欢的一款，个人感觉就是螃蟹加柚子皮味，怪怪的，让我有点恶心...,清香又凛冽的味道，不是甜甜的花香，虽然留香时间不长，但是我喜欢它自然又特别的香气～...,不喜欢..."
726,"澳洲自购 夏天用甜甜的...,很喜欢这个味道，单独喷有些些的单调和少女，但是确实是搭配的一把好手，搭配过迪奥的花样小姐，祖玛珑的虞美人与大麦，忍冬与印蒿，杏花与蜂蜜，没有一个失手过！大爱...,比较甜比较少女，但也不是那种很闷很成熟的，适合春秋冬还有初夏...,前调有酒的味道，还蛮特别，梨和花香也都有很好的表现...,我喜欢它 是因为它和Stella的同名很像 玫瑰与小苍兰的组合 爱不够...,相对于鼠尾草，还是更喜欢这支，有点酒味的感觉，留香时间也比鼠尾草久多了！鼠尾草貌似只有两个小时就没了……...,留香短，推荐黑石榴...,很多人夸这支，随意种草了，我怎么觉得带有点梅子的味道呢，酸酸甜甜的，比较英国...,一瓶用了3年多还有多一半，浓，闻久不鼻子不舒服啊，感觉还是不太喜欢...,这些是男友带回来给我和嫂子们的礼物 香味我不是很喜换 前调梨味 可能本身和我不爱吃梨子有关系 总之不是很喜欢..."
727,"当时屈臣氏活动买一赠一，和同学一起买 的。她是中性皮，脸上没痘痘，肤色偏小 麦色，买的是肤色那款，我有点偏黄，有 痘痘，买的嫩绿色。虽然我是偏黄肌，但 是用这个嫩绿真心好看，这款BB比较水 润，很好涂抹，但是...,包装很好，说好推，可是买回来，自己用了三次，个人感觉还是好推吧，因为个人比较少化妆，没有用过别的产品，可是本来我容易出汗的脸部一涂上这BB霜就更加容易彪汗了，因此妆很容易就融，所以后来都没有用了。...,也是在屈臣氏买的，同学和我一人一个，感觉挺滋润的，也比较白，差不多是第一个BB，当时觉得挺好的...,属于偏柔和的一款BB~很自然，遮瑕也就一般了~不过抹上去不会很白很突兀，只是相比夏天用，可能会略油腻些。...,屈臣氏会员88两大只，价格便宜。选自然色，涂上去偏白，不过比较贴妆，对于痘印不多不明显的皮肤来说已经足够了。性价比算很高了～...,非常好...,买的自然色，感觉一般般，遮瑕力度不够好，感觉什么都遮不住，质地不够轻盈，水润，比较油腻，妆效还不够持久~~~~...,当时屈臣氏活动买一赠一，和同学一起买的。她是中性皮，脸上没痘痘，肤色偏小麦色，买的是肤色那款，我有点偏黄，有痘痘，买的嫩绿色。虽然我是偏黄肌，但是用这个嫩绿真心好看，这款BB比较水润，很好涂抹，但是也容...,用过的最好用的BB，保湿度很好，遮瑕效果也不错，真是万金油BB此款质地很厚，很适合那些需要遮瑕的菇凉，遮瑕效果真的很出色呢，性价比很高。因为我肤质还不错，所以送给闺蜜了！...,一直在用这款..."
728,"温和不刺激，乳液质地很不错，不粘稠，用起来还有点淡淡的香气，很舒服，卸妆的力度也很不错，很好用的哈...,用起来还行...,不得不爱啊...,一直在用这款...,值得推荐的东东...,这款珍碧嘉温和眼部卸妆乳果然不错，一直在用，珍碧嘉家的产品一直以来就是比较喜欢的，很好，它的颜色也很漂亮，使妆容看起来给人很舒服的感觉。...,我的卸妆品比较多，大部分都是冲着包装去的，这款珍碧嘉的温和眼部卸妆乳质地很好，又方便补妆。这款卸妆品真的很赞！上妆在效果很好！...,质地轻盈，卸妆快速卸的也干净...,注意手法 会清洁的很干净 刚用完毛孔干净 皮肤软软的...,感觉不大..."
729,"觉得东西还行吧，那个时候很年轻啊，用什么都好，不过就是觉得太年轻了，用这款貌似不太适合……...,感觉不大...,这款乳液味道非常甜香，质地微粘，涂在肌肤上明显感觉很有光泽，质地柔滑细嫩，用后皮肤明显变得水润啦。...,很好用！...,就喜欢这个...,轻轻的涂在脸部，刚涂上的时候感觉有些白，不过随着脸部皮肤的吸收，就没有颜色啦，水质感很强，很好推开，而且吸收的也很快，一点油腻感也没有，很滋润，使用后感觉挺清爽的，脸部摸起来滑滑的，美白效果就要看日后...,很水润，适合这样干燥的季节来呵护皮肤。...,一直对乳液质地很挑剔，但这款完全符合我各种要求。细腻柔滑的白色乳状质地，延展性非常的好。有一点稀薄，不厚重，对肌肤无负担。易吸收，渗透效果好，深层滋润肌肤。清润不油腻，夏天也可以使用。...,不喜欢...,真的超好用！超赞，强烈推荐！..."
730,"....,中规中矩，留香不行...,试香后念念不忘的。毕竟还原度太高了，后来真买了以后，反而不爱喷了，有点腻，玫瑰是真玫瑰。...,喜欢...,纯正的玫瑰味道，像是走进一片玫瑰园。...,非常浓郁的玫瑰味，不过我个人不是那么喜欢玫瑰味，这算是他家的明星产品了...,开始是带着绿感玫瑰味，后来就是挺纯的玫瑰花味了，微微有一点玫瑰臭，有些人受不了，我是蛮喜欢的。...,喜欢更清淡的玫瑰味，后续的留香会更浓腻，熏的人好晕..., 终于拔了jm的红玫瑰，试过之后直接入了100ml的大瓶装，太好闻的玫瑰香了   怎么都不会觉得腻 就是他家一贯的问题 不够持久 ...,我是很爱玫瑰味的香水，这瓶没用出什么感觉，觉得层次不够，留香也不够长。..."
