,shop_comment
1359,"凑合，感觉不错...,就喜欢这个...,特别喜欢这个...,味道甜甜的，涂完后心情也变好了，该有全都有...,自己用过之后心服口服...,我常年必备的产品也就是这只唇膏，不管是春夏还是秋冬，这只唇膏非常滋润而且不油腻不难受，是目前为止我最爱的唇膏没有之一啊。而且就算用唇蜜什么的也可以稍微打个底，非常实用！...,颜色很好，比较清爽的感觉，而且不会掉色，喝水的时候不会印到杯子上，这个非常适合我，用了不算艳丽，但是很显气色！而且很滋润!...,颜色耐看，滋润的适中，不是涂上油腻腻或干干的那种。越用越喜欢，颜色和润度都刚好，涂上去不那么厚重，适合裸妆，很漂亮的颜色，很喜欢！...,口碑产品啊，自从用上就停不下来了。淡淡的粉白色半透明膏体，但是涂到唇上却会很神奇的根据个人唇色变得颜色更深点，我用完是变嫩粉色，滋润效果也还不错；感觉它变的颜色会很自然，一般人都能hold住的！...,又香又甜，甜蜜的味道，涂抹之后旁边的人都能闻到，很不错哦..."
1361,"羽西的东西还是不错的，只是这个精油不太适合油皮，稍微有浮油的感觉，最后直接每次加一滴到润肤霜里了，但觉得用的量不够，没显著效果，还是适合干皮妹子...,好久的黑名单了。产品都找不到了！！！！...,有淡淡的人参味，不油腻，北方冬天用很舒服。但锁水能力不是很足。滴管设计特别好，方便控制量，也干净。碰到活动也许回购。...,不喜欢味道，有些油腻，可能是混油皮的原因，对我来说太油了。...,在羽西天猫旗舰店买的，搞活动后价格非常可爱。使用感受也超好，不油腻，很滋润。可以长期使用，对干皮来说非常友好。怪不得欧家小伙伴极力推荐，可惜不红……...,         使用外观:      1、正面，银色的小瓶子；       2、近照；       3、瓶身背面的文件说明：   产品名称 ：羽西虫草焕颜新肌美颜油      产地：苏州尚美/上海美科   使用时避开眼周   净含量：5ml；       4、...,我都是混在精华或者乳霜中用的，增强保湿效果，会看到皮肤细腻通透了些。如果皮肤特别干，就单独在肌底液以后涂一层，不过混合皮肤建议晚上用。...,很感谢闺蜜，给了我这次机会，一直就知道羽西是个老牌子了，知名度也是很高，只是一直没有机会接触到，这是这个机会真不错，不过我想说- -太少了吧。
   金色的外包装，开瓶后散发出淡淡的虫草香，这种味..., 这次非常高兴收到羽西最近大热的产品，虫草焕颜新肌精华液，经过多年研究中医美容理论发现，28岁～35岁是女性肌肤护理的黄金期，只有把握这段黄金护肤期挑选最适合的抗初老产品，才能延迟岁月初痕的到来，达到事半功...,入秋了，皮肤状态很不稳定，时常冒痘痘，皮肤还粗糙，想起家里还有美颜油，先拆了试用装用了两天，第二天是配合净化面膜用的，还加上了新出来的精华，乳液，一夜过来痘痘消下去不少，皮肤感觉也细腻紧致了。果然没有..."
1362,"曾经在天津乐宾入过很多羽西的护肤和彩妆，升级成会员后还有会员礼，当时买是贵但是现在网上买都好便宜，，，原谅年少无知的我，，，白玲珑系列是几年前它家主打的美白系列，几乎所有单品我都用过，但是只有即时效果...,这款套装呢，非常适合出去旅游的时候携带呢，可以满足旅游时期的护肤需求，不至于肌肤晦暗呢，丰富的成分可以更好的护肤...,涂上去粘粘的，早上起来以后，未见滋润效果！所以不打算再使用这个系列！总之，说是升级的产品，除了价格贵，效果未见升级…..., 【谁说“闺蜜”不“女人”？】   整个羽西曾经评价过，印象平平除了红瓶子。看见就随手来一句，用过白玲珑系列现在质地味道都忘了，可见他实在太平淡。别说你白了。我反正无感。信不信由你反正我是信了。    ...,不推荐...,味道怪...,期待ING...,水水蛮大的一瓶，挺大方的，味道舒服，质感不错。评教美白效果的话是我要求太高了。...,最近正在使用羽西白玲珑系列，特喜欢羽西家族护肤品，每一款都很有针对性，特别给力。非常适合25岁左右及40岁以下的女性使用。...,痘肌大作战，油性肌肤爱用品分享心得，摆脱痘痘困扰，祛痘从基础护肤开始。任何护肤品都得试用后辨好坏，使用羽西白玲珑系列一周后效果还是令人很满意哒！使用前脸部皮肤干燥暗沉、伴有痘印烦恼；连续使用一周后：肌..."
1363,"拍在肌肤上很易吸收，温和不刺激，补水效果好，渗透力很轻，深层润活肌肤。用后清爽不黏腻，比较喜欢这样的水水，冬夏皆可使用。性价比比较高。单一的补水爽肤水，对肌肤无负担，很好用...,这个不错的...,虽然很少化妆，但是也不影响我喜欢化妆品...,平平吧...,好东西...,真的好漂亮，好精致。赞一个。...,不会回购这款的...,修复的效果确实很好，现在皮肤干的问题基本上没有了，坚持使用主要是因为它可以调理肌肤，适合长期使用。...,先用着，不会再买...,在皮肤不是很干燥的情况下，一滴可以涂满全脸的。味道是一般的香味，快吸收的时候我似乎闻到有酒精味，吸收的很快，皮肤会看起来湿润一些，摸起来还是很滑的。..."
1364,"颜色很艳丽，而且持久性不错，很容易就干了，对指甲没有伤害，指甲不易断和损伤，很不错的产品，值得使用。 ...,近期超爱的这个雅丽莎双层彩妆盒，质地细腻，又方便使用，搭配正流行的颜色，妆感光亮饱满！...,颜色不太适合我，不过质量还是不错的，从早晨划上一直到下班都不会晕眼圈哦，只是有点粘粘的，宝贝还是值得推荐...,我都可以看到模特的身影，而我们都被她们精致妆容所吸引，尤其是那深邃又明亮的大眼睛。大眼睛的秘诀少不了眼影的功劳，所以对这款光影错觉眼影也长草已久。...,不喜欢...,一般般的东东...,运用与肤色最接近、融合主色调，透过光与影的对比效果塑造层次感的渐变妆容。可以单色使用或混色配搭使用，缔造柔和感同时收紧眼形轮廓....,颜色很漂亮，滋润度也刚好:)...,效果还不错，有隐隐的珠光闪现，又不会太炫，主要是简便易用。...,眼影盒本身设计的很独特，它的显色度非常好，薄薄的涂上一层就会很好哦~~  只需要轻轻的涂抹就OK了，以免新手会把眼睛画的看起来有点浮肿。..."
1365,"　　要加强补水才行，平时多喝水，另外适当敷下补水面膜，还要注意防嗮。像你这种情况也可以用菲泊丝丽去掉的。一般来说2个周期左右可以去掉。...,我怀疑里面加入激素成分了，刚开始用的时候效果倒是挺明显的，后来不用了，蝴蝶斑就又冒出来了，效果也不持久，说实话很不喜欢的一款...,我是怀孕后长的斑，长的时候挺容易的，真等祛斑的时候才知道难，我用了很多去班的东西啊，可用的时候斑淡了，不用后就反弹，后来用的花青宜葡萄籽 ，当时用的时候效果就很好，用了两个周期斑就没了，当时很高兴又怕反...,朋友送的...,一直在用这款...,感觉不大...,真的好漂亮，好精致。赞一个。...,我的肌肤很干燥，使用这款精华后，感觉肌肤真的好润好滑，非常细嫩了，不愧为大牌呀！...,对于这款产品，一直有听说，但未尝试过，希望能感受到自然温和的产品给肌肤带来安全的感觉。...,再也不买了..."
1366,"一朵美白晶澈爽肤水外包装是很简单的风格，分量很足，涂抹在脸上有美白和亮白的作用，使用方便，性价比还是很可以的，使用之后的感觉很舒服，有不错的改善肤质的效果，这是一款很不错的水，吸收的很快，肌肤使用的感...,这款水水具有优雅的渗透力，能即时补水，并舒缓肌肤调理至理想状态。里边的植物精华成份更能滋养肌肤 喷雾的水水有一点淡淡的白色，质地没有想像 中的清澈，但却给肌肤带来一种畅快的清新感，因为是无香料无防幅...,一朵美白晶澈爽肤水除了很好吸收以外没什么其他效果了，但毕竟作为一款水水也没什么太大奢望，只要好吸收不黏腻就行了，值得大力推荐一下...,这款化妆水的味道是很好的，清淡的香气，一点不刺激鼻子，味道好闻，水水的质地十分清爽，流动性是很好的，使用也很方便，使用在脸上感觉很舒服，没有什么刺激性，温和的水吸收之后脸部肌肤感觉很光滑，也很水润，保...,质感醇厚，推开过程非常细滑，很润的触感但清新感适度。丰盈的适度润，并且涂开的时候感觉皮肤有淡淡的清凉感，亲肤性出众，使用初体验方面是会觉得质感精致，皮肤易接受，并且没负担。...,蓝色水水，吸收很快，配合活肤精华，没有美白效果~~~~~~~~~~...,价格不贵，很实惠的一款，打开之后会发现味道清淡不刺激，没有粘腻感，适合混合肌肤夏天使用的...,这款水水性价比还算不错啊，保湿紧致肌肤，淡化脸上的小瑕疵，用化妆棉擦拭后吸收很好啊，...,赞一个...,不刺激皮肤，长期使用后，效果不错，收缩毛孔的效果很好，保湿度也很好哦！..."
1367,"能抗氧化，激活细胞再生，这款精华比较滋润，含油量高一些，保湿效果好，需要按摩一下才能吸收，用后肌肤比较滑，虽然没有看到抗皱紧致的的效果，但就这个价位也算不错了...,凑合，感觉不错...,滋润度非常够，但是却不会觉得油腻，尽管膏体比普通略厚，却不用担心吸收不好或者搓泥，感觉非常好。...,用过一瓶，感觉非常好！用手触摸就像婴儿般的肌肤，丝绸般的感觉！...,净化肌肤老化角质及杂质，加速新陈代谢，缔造透明而富有光泽的肌肤。...,一直在用这款...,洗完脸后马上涂上这个感觉脸上嫩嫩的，也很补水，冬天我的皮肤就会很干，用这个很好...,就那样吧，一般...,没什么感觉...,有保湿美白效果及有效去除死皮细胞,保持皮肤清爽感觉,令皮肤容易吸收。..."
1368,"质地比较清透，无油腻感，吸收度很好，渗透性也很好，用完肌肤会觉得得到了很好的润泽，感觉水嫩水嫩的，非常细滑，坚持使用效果更佳。...,我很喜欢...,肌肤从未有过的柔软、细腻、滋润、肌肤肤色变得匀净，有光彩！...,发发一些正在使用的精华护肤产品，小白鼠各种试用，总结最好的经验给大家。...,只用一点点，均匀涂抹，就可以感受到有水珠渗透出来，非常好用，补水很不错。特别是在春天的时候，天气比较干燥，但是用了这款精华露，皮肤感觉软软的，一直都感觉不到紧绷，非常水润。...,用了感觉不错...,感觉不大...,第一次接触一朵祛痘修复精华素，效果让我很满意，大家都知道护肤是一个循序渐进的过程，长期坚持才能看到效果。肌肤已经产生的问题不会擦了东西就立竿见影，只能慢慢改善，总体来说这款产品是非常值得试一试的。...,几年了，这个产品大概用了不下30管了吧，家里会常备，基本上都是常备5管，用到还剩一管了就继续购入。
换季或者上火，就会起痘。洗脸后，把这个涂抹在痘痘上，周边也稍微涂点点，第二天就会稍微下去点。连续几天，痘...,涂抹时，却可以感觉精华露的延展性很好，瞬间也变得不是那么厚重，比较轻薄，精华很好吸收，涂抹片刻就基本上被皮肤吸收了。..."
1369,"这个上哪里能买到...,一朵活菌酵母修护晚霜这款感觉滋润度更高一些，秋冬季使用应该更好一些，不但能有效润泽肌肤，还能修护受损细胞，促进再生...,深层补水修复肌肤效果很好啊，比较柔软，容易涂抹肌肤，嫩白肌肤，淡化瑕疵效果不错啊，很好吸收。...,就是感觉液体挺漂亮的，有点像金粉的感觉，估计以后不会再入手了...,好...,很棒的产品...,发发一些正在使用的面霜护肤产品，小白鼠各种试用，总结最好的经验给大家。...,这款保湿霜刚摸的时候会有点油，但是很快就吸收了，所以建议MM们不要用太多。用后，肌肤细腻光泽有弹性，纹理也清晰了，保湿补水的效果也非常的好...,3个字,非常好....,用过的脸霜里最轻的了，挺舒服的没不良反应，我的敏感皮要求就这么简单了..."
1370,"这款浪漫莲花水也是学生时期用过的产品，那时候还很喜欢他家睫毛膏，所以每次去买睫毛膏会顺便入点别的，这款乳液感觉一般般吧，就是很基础的一款水...,款水水虽主打是吸收度，不过我感觉吸收不是很好，渗透也不是很彻底，没有那种瞬间就渗透基地，深层润活肌肤的感觉，补水效果倒还算不错，保湿也可以。就这个价位而言，算是不错了。...,性价比不错，保湿很好啊，随时补水，喷出的水水很细腻，紧致肌肤效果也不错啊，值得推荐的水水。...,这个水水保湿又锁水 当爽肤水用也可以 定妆喷点也很好 就是爱…比较补水，尤其比较适合长期面对的电脑的MM使用…...,这个喷雾的喷头不好用~喷出了雾化效果不好~~感觉不是很喜欢~~...,大爱他家的东西...,很有质感的水水...,一朵这个牌子的产品一直是我的最爱啦！我一直是它的忠实粉丝，多年来一直坚持购买使用，肌肤的状况真是保持的很好啊！都说世界上没有丑女人只有懒女人，当然，选对适合自己的品牌就显得尤为重要啦。...,建议大家使用爽肤水的时候搭配化妆棉使用，不仅可以二次清洁肌肤，还能让产品涂抹的更均匀...,凑合用着..."
1371,"喜欢这个品牌...,这款口碑不错的...,痘肌大作战，油性肌肤爱用品分享心得，摆脱痘痘困扰，祛痘从基础护肤开始。任何护肤品都得试用后辨好坏，使用伊奈美莹透细肤水凝露一周后效果还是令人很满意哒！使用前脸部皮肤干燥暗沉、伴有痘印烦恼；连续使用一周...,没事就擦擦还是挺好。...,能快速改善肌肤干燥，暗哑情况，同时还能为肌肤保鲜。...,真的很好，周围的人都力挺的宝贝哦！...,有时皮肤在极度缺水的情况下，且乳液补水效果好，那麽皮肤在快速大量吸收水分的时候就会感到刺痛。这是正常现象，恰恰说明乳液的效果很好。我建议用这个...,适合混合皮用得乳液现在秋天晚上用滋润度刚刚好大概我脸大要按2-3下才能全面涂匀吸收得很快有点淡淡的香味效果好好无论是挤痘后或者是晚睡第二天起床肤色依然好明亮~不干不油得不过冬天大概不够力~~...,第一次使用伊奈美这个牌子的产品，感觉很不错，期待后续完美效果。会上来向JMS报告战果啦！...,这个不错的..."
1372,"用过两瓶。感觉还算不错吧。性价比挺高的。早上用过它的水。再擦它。感觉脸粉粉的。确实美白哦。用过这么多。感觉它还好。...,性价比很高哦，用起来舒服又有效的一款晚霜，肌肤非常光泽柔嫩光滑很滋润柔嫩光滑。一整晚滋养肌肤给予肌肤需要水分。美白肌肤水嫩水嫩，美白修护，皮肤变得滑滑的充满弹性，白皙光彩。...,补水 锁水效果很好啊，质地很水润，任何肌肤都可以使用，换季肌肤干燥缺水的现象，嫩白肌肤效果不错哦。...,凝露的质地，适合油皮和混合皮使用，平衡油脂分泌，滋润不油腻，很好的补水保湿效果质地很温和。...,非常棒的产品...,用起来还行...,护肤品喜欢用一套的 所以这个是为了搭配爆水而购的 最为霜来说质地厚厚的但是不油腻...,Lulu在前期调查表里说自己“基本上从不使用面霜，因为很爱长痘痘，害怕稠厚的质地会堵塞毛孔。”专柜的人说要想保湿，一定要用面霜锁住水分。面霜不是长痘痘的根源，如果怕油腻，也有很多质地清爽的面霜可选择。 结果...,跟风失败了...,瓶子非常漂亮，另外涂抹在脸上很滋润，一点都不油腻，味道也很好，很喜欢，擦在脸上很温和，不油不腻，很容易吸收..."
1373,"很赞...,这个不是很能渗透，质地比较Q弹，不是纸质的，半透明的果冻，敷上去比较新鲜，是专柜当时送的赠品，不会购买。...,分别在两个眼睛上按摩吸收，因每个人的眼睛都不一样大小，可以按自己的对比来涂抹。...,非常喜欢的包装，涂抹吸收好，滋润度不错。...,用完后眼周非常舒缓，晚上睡前使用可以促进睡眠。...,非常棒的产品...,轻轻点压，直至完全吸收，真的非常滋润，特别是刚刚涂好的时候。...,我是干性肌肤，时常忘记护理皮肤，加上年龄上去了，眼角的皱纹很明显。每周都会坚持用上那么一两次，用了一个月多，最近感觉眼部色斑也淡了，细纹少了，眼部重现以前的光彩...,用起来还行...,希望可以延缓眼部衰老，这用起来还比较舒服。..."
1374,"朋友送的...,挺好的...,很棒的产品，推荐...,非常好用的乳液，吸收很快，很温和的一款产品，很喜欢。...,感觉还可以，挺滋润的，脸上好像涂了保护膜，皮肤蛮嫩的，但是离预期效果还有点距离。夏天没有使用，冬天必备，滋润皮肤不干燥。...,好吸收，不泛油...,第一次接触伊奈美莹透控油调理露，效果让我很满意，大家都知道护肤是一个循序渐进的过程，长期坚持才能看到效果。肌肤已经产生的问题不会擦了东西就立竿见影，只能慢慢改善，总体来说这款产品是非常值得试一试的。...,支持一下...,一直在用这款...,真好，不错..."
1375,"质地比较清爽，夏天用感觉还不错，不会觉得油，但是秋冬的话就显得比较单薄了，用完还是觉得干，不过对这个品牌还是比较有好感，可能比较少人听说，不过效果真心不错...,价格能够接受，保湿，平衡油脂效果很好啊， 比较适合毛孔粗大的mm使用啊。修复肌肤。……...,看起来是膏体，粉扑一抹是液体，到脸上是粉状的，我每次用了脸上都好滑，肤色看起来会很好，...,挺好的...,一直在用，非常好...,还会回购的...,有点猪油膏的意思，但是涂在T区，就是把毛孔堵住了，再涂其他的，就会搓泥，不好。...,我很喜欢...,是买伊奈美其他产品赠送的。偶是干肌，不能用海绵，就用手涂，不知道为什么怎么也涂不匀，脸上老是一块白一块白的。。。所以就扔下不用了，防晒效果未知。。。...,我相信口碑..."
1376,"
	超赞，强烈推荐它家的东东！


	这款卸妆油更是偶的大爱呢，一点也不比DHC的逊色，但知名度，好像还是没人家的高~二者同样都蕴含丰富的橄榄油成分，但DHC的油性更大些，呈黄色；而伊家的有乳液成分似的，看起来...,专柜送的，还行，但是我还是比较偏爱卸妆液，不是很喜欢卸妆油。...,我很喜欢...,用了很惊喜...,还可以哦，因为比较少用卸妆品，也没有太多可以比较的。但自我感觉还不错，贵在自然，用量也省可以用好久，自然好气色！...,卸淡妆 正好脸部按摩...,抹在脸上油油的，不过乳化后就好了，可是还是会长封闭性粉刺，比起FANCL还是差很多，还好是小样。...,不刺激而且洗完后很保湿...,伊奈美的卸妆品产品，从来都是我的第一选择。首选这款清莹净肤卸妆油也是有它的道理。这款卸妆品手感非常好，颜色也很正，适合不同不同肤色的JMS...,挺好的，不刺激..."
1377," 去年冬天 这个水凝乳和那个精华美肌液一起使用  皮肤状态非常不错   会回购的好定西  保湿效果挺不错 ...,乳液即清爽又滋润的 是我春夏的大爱啊 吸收非常好 用完后脸也QQ的像喝饱了水一样 很喜欢用这个乳液的感觉 而且这个乳液质地很细腻...,类似于水和乳之间的质地，保湿很好啊，温和不刺激肌肤，质地的延展性也不错啊，很好的呵护肌肤。...,水润精华乳液，充分提供肌肤健康的水润滋养，令肌肤水润透亮, 散发水润光彩。能感到肌肤不断吸收着精华成分，不过，不太喜欢它的油腻质地，我是油性肌肤，最受不了油腻，用起来还行！...,这款乳液很好的保湿功效，美白剂提亮肤色效果不错啊，质地很水润饱满，嫩白肌肤效果很好。...,性价比不错啊，保湿滋润肌肤效果很好啊，质地比较水润，很好涂抹，涂在脸上水水嫩嫩的很舒服。...,真好，不错...,喜欢这个牌子的很多东东。...,很水润，适合这样干燥的季节来呵护皮肤。...,非常好用的乳液，吸收很快，很温和的一款产品，很喜欢。..."
1378,"伊奈美...,带着对爆水的好感入的，比较像水一样的质地，拍棉片敷纸膜都可以，不会造成敏感，夏天日晒我敷纸膜镇定肌肤，有一定效果，但是不如日系知名的几款水，可能更适合20岁.皮肤没啥问题的MM...,不会再买，因为用后觉得可有可无没有特点。它是作为sk2的便宜一点的line来开发的，效果远没有说的那么好，这个抹上之后觉得粘，却又没有那么保湿。...,美白修护效果不错啊，这款修护脸上的小斑点还是有效果啊了，滋润紧致肌肤效果不错的啊，质地比较浓稠，还会回购的。。。。...,以前是张柏芝代言的，现在商场早就撤柜了，用了保湿和美白的套装，都感觉不怎么样，保湿度不行。...,一直在闺蜜四处寻找补水的DD，那天看到这款评价挺不错的就买了。
可用起来真没感觉，我是用拍的，可拍了半天还能看到水在皮肤表面好像进不去似的，不知是不是分子不够细，个人没觉得补水。...,跑了第二家屈臣氏才买到的 据说要撤柜了
用后感觉不吸收~~浮在表皮看上去油油亮亮的~~~很是不喜欢~~~但也不能说它的保湿功能不好~~~~甘油添加的多了~~~
打算涂身体~~~~@！！可笑的是我买了150ml还送了瓶250ml的~~~...,这个水肌液网上口碑很好,有机会试用了一下,感觉非常好用,很保湿,水润润的,适合偶,秋季用很好,而且很清爽,不过这里有没专柜的,很喜欢....,我个人感受是比较清爽，不油腻，保湿作用肯定还是不如玻尿酸成分产品强大，但是比较适合夏天使用吧。...,第一次打开瓶盖，突然闻到的香气立即让我精神愉悦。挺好用的，感觉比较天然，容易吸收，皮肤用后觉得很舒服，有舒缓的效果，第二天起床气色好多了，容光焕发。很多朋友跟我用同款的，都说不错的呢！..."
1379,"挺普通的美白精华，没有什么太明显的效果，不过好行肤色被均匀了一些，一般早上起来比较明显挺普通的美白精华，没有什么太明显的效果...,大力推荐...,凑合，感觉不错...,我很喜欢...,灰常好...,肤质得到前所未有的改善，触感细腻柔滑，肤色纯净匀亮，由内而外绽放于生俱来的肌肤之美。...,我用了一个星期左右吧，每天早晚各一次，皮肤明显改善了，感觉光滑了。...,吸收得特别快，清爽又补水，用完脸上特舒服，保湿的效果能持续一天呢。...,涂在皮肤上推开后，吸收也特别快，轻轻拍几下就完全被皮肤吸收了。...,肌肤从未有过的柔软、细腻、滋润、肌肤肤色变得匀净，有光彩！..."
